<?xml version="1.0" encoding="UTF-8" ?>
<!DOCTYPE ingredients SYSTEM "../dtd/ingredient.dtd">
<ingredients>
	<ingredient unit="g">
		<id>0</id>
		<name>Edam Cheese</name>
		<truck_stock>1580</truck_stock>
		<kitchen_stock>5500</kitchen_stock>
		<dietary>
			<vegetarian>true</vegetarian>
			<nut_free>true</nut_free>
		</dietary>
	</ingredient>
	<ingredient unit="count">
		<id>1</id>
		<name>Hamburger Bun</name>
		<truck_stock>45</truck_stock>
		<kitchen_stock>256</kitchen_stock>
		<dietary>
			<vegan>true</vegan>
			<vegetarian>true</vegetarian>
			<nut_free>true</nut_free>
		</dietary>
	</ingredient>
</ingredients>